"id","article_body","image_hash","title_1","title_2","title_3","title_4","title_5","title_6","title_7","title_8","title_9","title_10","y_true"
"8f1470b2f3b51361d85cab7512d2fd0edd455ff0c77b00d6099d8b24c5a9fd9b","El enésimo golpe asestado por el Covid a la economía española, ahora sacudida por el súbito retraimiento de un consumo privado que suele tocar techo en las fiestas navideñas, es el prólogo de un 2022 que de nuevo va a estar marcado por la falta de previsión del Gobierno, no solo a la hora de frenar el impacto sanitario de una pandemia que se apresuró en dar por vencida, sino para amoldarse a un escenario económico falseado por sus necesidades estratégicas y su programa de propaganda y condicionado por las crecientes demandas de sus socios de legislatura. Aquella ‘recuperación en uve’ que se iba a producir en otoño de 2020, pocas semanas después de que Pedro Sánchez declarase con solemnidad su primera victoria sobre el Covid, se retrasó al ejercicio siguiente, un 2021 que termina con una dosis aumentada de desconfianza, certificada ya por las principales organizaciones internacionales. Todo se aplaza, salvo el optimismo táctico del equipo que dirige Sánchez. El año que hoy arranca no solo va a poner a prueba las promesas del Gobierno -incumplidas de forma recurrente en los últimos meses, al ritmo de las sucesivas olas de la pandemia- sobre una recuperación que en otoño se anunciaba «robusta», «justa» y en marcha, sino que va a convertir al Ejecutivo en rehén de sus propias trampas. Ajustados a un cuadro macroeconómico inverosímil desde hace meses, ajenos a cualquier rigor y aprobados por Bruselas por la excepcionalidad y la manga ancha decretadas en 2020 para evitar, sin reglas fiscales, ataduras financieras en la batalla de los socios comunitarios contra la pandemia, los presupuestos de 2022 fueron una farsa en su redacción y van a terminar por ser una tragedia para los españoles, víctimas de un Gobierno que desde el comienzo de la pandemia ha sido incapaz de asumir su responsabilidad en los campos de la salud pública y de la economía, igualmente graves, y de adoptar políticas de ajuste, sanitario o presupuestario. Tiempo tuvo el Gobierno, advertido desde los más diversos foros económicos, poco sospechosos de participar en la presunta conspiración de la derecha que denuncia Sánchez, de cambiar el rumbo y ajustarse el cinturón. Ahora es tarde. Al margen de sus leyes de progreso -eutanasia, adoctrinamiento y deterioro escolar, animalismo, ideología de género, memoria democrática-, el déficit y la deuda van a ser la herencia que deje un Ejecutivo cuyo agotamiento, ya testado en los sondeos de opinión pública, van a medir las urnas. El ciclo electoral que abren los comicios regionales de Castilla y León podría continuar en Andalucía y desembocar en un adelanto electoral que, por primera vez en cuarenta años de democracia, no solo va a depender del presidente del Gobierno, sino de sus socios de coalición, conjurados para su desgaste.Los ajustes tendrán que llegar, tarde o temprano, desde La Moncloa o desde Bruselas, y los tendrá que aplicar este Gobierno, a costa del acuerdo de intereses y eslóganes que mantiene con Unidas Podemos, o el que salga de las próximas elecciones generales. Los dos socios del Ejecutivo disputan una carrera hacia el precipicio, con España en el maletero, y solo saltarán del coche cuando su farsa se manifieste en toda su dimensión. No cabe esperar un postrero ejercicio de responsabilidad y de servicio a España en quienes han llegado hasta este 2022 con un equipaje cargado de excusas, traiciones y mentiras, ni siquiera para tratar de salvar los muebles y rectificar sobre la marcha unas cuentas que no cuadran y que condenan a todos a la ruina y al pago de facturas atrasadas. Esa es la verdadera Agenda 2030. Cuanto antes la asuma Sánchez, o se la entregue a su sucesor, mejor.","9e85245870bf96d8880edf82bface386","Las investiduras de todos los candidatos a presidente del Gobierno de España","El Gobierno asume la gestión de la crisis en Valencia tras pedir Mazón el nivel 3","Editorial ABC: El año de los ajustes","Belén Hoyo dimite como miembro del Comité de Dirección del Partido Popular","Editorial ABC: Ni para los secretos de Estado","Ayuso: «Pedro Sánchez lo hace todo al revés podría haber empezado por pisar la calle»","Viaje a Madrid: El PP pagará el viaje a la manifestación contra Sanchez incluso a los no afiliados","La vivienda y la ley andaluza sobre Doñana desplazan al ‘solo sí es sí’ en el choque entre Gobierno y oposición","De «Mr. Marshall» a «Mr. No»: ¿cómo será ahora la relación con EE UU?","Un centenar de condenas por agresión sexual podrían revisarse en Andalucía","t3 t2 t5 t1 t4 t8 t10 t9 t6 t7"
"734bca6fa7bc34a251a101f94ac9863e347595f3ba57d939be30a2872a2fe173","El ex número dos de Cerdán en el PSOE: “Nunca vi en él un nivel de vida desproporcionado”","bed11abc197afb9de5ae3a4b2c330209","Feijóo acusa al Gobierno de ser el que más ataca la Constitución y a Sánchez de tapar el caso Salazar","Feijóo: «Prefiero mirar a los ojos a la gente desde la oposición a bajar la cabeza para entrar en Moncloa»","Multas de hasta 150.000 euros y otras nueve claves de la nueva ley de memoria","Los votantes socialistas prefieren PP o abstención","Belarra destituye a Enrique Santiago de la secretaría de Estado y nombra a Lilith Verstrynge","El 80 por ciento de los votantes del PP creen que Casado debe dimitir","El ex número dos de Cerdán en el PSOE: “Nunca vi en él un nivel de vida desproporcionado”","Aldama reta al PSOE a querellarse contra él por injurias y calumnias","La pluma de Hemingway y el hipopótamo dorado: el legado de Vargas Llosa para rebajar la tensión entre el Cervantes y la RAE","El nº 2 de Cerdán en el Senado: «Nunca vi en él un nivel de vida desproporcionado, sólo trabajo»","t7 t9 t10 t8 t6 t3 t2 t1 t5 t4"
"7e147f3cd108b2b4f0678b54612ed107bdaad5229272d63e068b975826a55243","El presidente del Partido Popular, Alberto Núñez Feijóo, se ha dirigido a todos los españoles para ""pedir disculpas"" en nombre de la política por el ""espectáculo"" de Pedro Sánchez con su ""dimisión simulada"". Una actuación que ha calificado de ""indigna"" y sobre la que ha augurado que todavía quedan ""días de bochorno"".""Le ha tomado el pelo a 48 millones de españoles"", ha resumido el líder del PP, que insiste en hablar de ""estrategia electoral"" del presidente, con el objetivo de evitar dar explicaciones, tanto a los españoles como en los tribunales. Un presidente del que ha dicho que ""tiene miedo"" y ""ha emprendido una huida hacia adelante"", avanzando que ""su proyecto se acabó"".Feijóo ha descartado presentar una moción de censura y ha avanzado que mañana reunirá a sus grupos del Congreso y el Senado para, se entiende, preparar la ofensiva de la oposición contra el Gobierno, sin querer ""especular"" con las amenazas lanzadas por Sánchez a los medios, los jueces y los partidos. Tampoco ha querido confirmar si le llamarán a declarar a la comisión del Senado o si acudirán a los tribunales.El líder del PP ha salido en defensa de los jueces, los medios y las instituciones como garantes de la democracia, reprochan a Sánchez pretender situarse por encima de todos ellos y acusándole de querer ""polarizar"", ""dividir"" y ""victimizarse"" para eludir sus responsabilidades como presidente del gobierno y la fiscalización obligatoria del resto de poderes públicos.En cuanto a las investigaciones sobre su mujer, Begoña Gómez, y las decisiones adoptadas por el Consejo de Ministros, Feijóo ha advertido de que están a la espera de que se conozcan las pesquisas recogidas en el sumario, incidiendo especialmente en el volcado de los móviles, hasta 23, de los asesores e implicados en la posible corrupción del Gobierno.Discurso de Feijóo Muy buenas tardes a todos y muchísimas gracias por su presencia.  Voy a comenzar dirigiéndome a los españoles. Por encima de cualquier valoración que pueda hacer de la intervención del presidente del gobierno, debemos tener claro es que, se extienda lo que se extienda su mandato, todo esto que estamos viviendo ya no es más que el epílogo de un pasado que vamos a superar.  Acerca de que el presidente del Gobierno no tenga problema en hacer el ridículo yo no tengo nada que decir. Allá él. De que arrastre a mi país a ese camino sí quiero hacer una consideración.  España no tiene un presidente a la altura de sus ciudadanos. Por eso, quiero empezar pidiendo disculpas a los españoles en nombre de la política, y paciencia en nombre de la razón. La política que España merece llegará.  Como la gran mayoría de ustedes, he vivido los últimos días con perplejidad.  Aunque, como les pasará también a las personas que me escuchan, la capacidad de asombro ya se ha reducido a lo largo de los últimos años porque esta crisis no nació el pasado miércoles ni termina hoy.  Estos cinco días simplemente han sido una semana más de varios años de bochorno. Lamentablemente, llevamos demasiado tiempo asistiendo a actuaciones políticas que no habíamos vivido antes en nuestra democracia.  Sobre todo, los meses de esta legislatura que sólo ha consistido en retrocesos en materia de igualdad ante la ley, en estabilidad política y en libertad ¿Para qué?, para que el presidente mantenga su estatus.  Hemos pasado de los engaños electorales a una agenda política marcada por las cesiones a las minorías independentistas. De los atropellos democráticos a la renuncia a presentar los Presupuestos Generales del Estado. De los escándalos de corrupción que no han merecido ni explicaciones ni disculpas, al propósito de partir en dos a la sociedad española. De su derrota electoral, hemos pasado a un completo esperpento.  El PSOE se muestra en estas horas aliviado por la continuidad de su líder. Me imagino que los independentistas también.Pero hay una España indignada a la que quiero dirigirme.  Comparto que le han tomado el pelo a una Nación de 48 millones de españoles y yo no participo en esa forma de entender la política.  El presidente del Gobierno se ha ido de puente por pura estrategia electoral, judicial o ambas, pero los problemas de los españoles NO. El señor Sánchez ni ha acertado en el qué, quedarse, ni en el cómo, condenando a nuestro país a días de bochorno internacional y de incertidumbre nacional.  Dije este fin de semana que no habría épica en la marcha ni heroicidad en su resistencia. Y lo mantengo. Hoy el presidente del Gobierno ha preferido huir hacia adelante a dimitir.  Podría haberlo dejado asumiendo sus responsabilidades por lo que está sucediendo hoy en España y diciendo la verdad a los españoles, pero ha preferido hacer lo contrario. Ha mandado reflexionar al pueblo, pero no le ha dado la palabra. Le ha interpelado, pero no ha querido escuchar su respuesta. En lugar de dar explicaciones a los españoles, le exige rendición de cuentas a los demás. Y, de nuevo, ha sometido a toda la nación a su estrategia personalista.  He visto que lo ocurrido estos días ha generado chanza en muchos españoles. Pero esto no es cómico. Es trágico. Lo es porque ser imprevisible no son atributos a valorar en un dirigente. Lo es porque se ha hecho un gran daño a la imagen de nuestro país. Pero, sobre todo, lo es porque su discurso de hoy es el más peligroso de todos los que ha entonado.  La reflexión de Sánchez termina con una confesión que en realidad ya todos conocíamos: no acepta la discrepancia. Quiere un país a su medida y a su servicio, ciudadano a ciudadano, institución a institución. Y detrás de toda su escenificación está la pretensión de ser aún más presidente, aunque sea a costa de aún menos Democracia.  No quiere oposición.  No quiere Justicia.  No quiere medios de comunicación.  Y sólo se quiere a sí mismo.  En mi humilde opinión, el verdadero sentimiento que le ha movido estos días es el miedo. Por ello ha sido capaz de utilizar hasta su intimidad para intentar ganar tiempo. Se ha atrevido a revestir como conjura antidemocrática su intento de no hacer frente a la realidad democrática.  Ha llegado a usar a Su Majestad El Rey como actor secundario en su última película. A lo que no se ha atrevido es a dar ni una sola explicación acerca de las dudas que cada día están más vigentes. Sus problemas permanecen y se acrecientan mientras su crédito desaparece.  Hoy Sánchez no ha asumido sus responsabilidades, sólo se las sacude. Y se agarra al comodín de ""derecha y ultraderecha"" que utiliza siempre como anticipo de sus próximos desmanes. Pero ya no hay vuelta atrás ni huida hacia adelante posible: Su proyecto se acabó.  Y puede prolongar la agonía y la decadencia, pero no será nada más que eso: agonía y decadencia. España necesita un tiempo nuevo y no puede ya encontrarlo en quienes son el pasado. Lo que necesita España es un nuevo gobierno democrático, con un presidente a su altura y no el cambio de régimen que pretende colar por detrás de toda esta obra de teatro.  Ha dicho que ha sopesado continuar o no y lo que quiere es que los españoles dimitamos de la democracia. No lo vamos a hacer. No vamos a callarnos. No van a arrinconar a quienes defendemos la libertad de poder ser críticos y exigentes con nuestro gobierno.  No van a someter una vez más la dignidad de esta nación a sus intereses. No vamos a volver a los dos bandos. No van a lograr la impunidad en una nación que hace 46 años decidió libremente que nadie puede ser más que nadie, por muy presidente que sea.Si no ha habido dimisión y no ha habido explicaciones, ¿Qué ha habido hoy? Las amenazas de un Presidente acorralado. Sánchez ha elegido intentar cohesionar a los suyos a costa de dividir a España en dos.  Es absolutamente lamentable oír hasta a los ministros del Gobierno hablar de buenos y malos. La España del conmigo o contra mí es la fórmula que ha escrito las páginas más negras de nuestra historia y no queremos volver a ella. Nos quieren en un bloque al que no pertenecemos y en el que nunca estaremos.  Además, nos hacen un retrato oscuro para ocultar la oscuridad de sus pactos y de aquellos con quienes los han firmado. Ponen el foco en los demás para que apartemos la vista de lo que no quieren que veamos. Pero todo es demasiado burdo, demasiado evidente. La sociedad española no se va a dejar engañar, por mucho que le quiera mentir.  Que el señor Sánchez sepa que después de su teatro, su realidad no ha cambiado ni un ápice. Sigue habiendo una investigación en la Fiscalía Europea, dos en la Audiencia nacional y comisiones de investigación que no controla como la del Senado sobre la presunta corrupción de SU partido, SU gobierno, y SU entorno.  Quien amenaza a la democracia española es quien pretende imponerle un proyecto de puro poder, sin límites, para no dar las explicaciones que le exige la sociedad. En un Estado de Derecho no se puede invocar el poder al mismo tiempo que se impide el control por parte de quienes son tan legítimos como pueda ser el Gobierno.  ¿O es que la oposición no sale de las urnas? ¿O es que los poderes distintos del Gobierno no son poderes constitucionales? ¿O es que las libertades no están en el pacto constitucional y en el Derecho europeo?  Que los jueces actúen con independencia no es una anomalía democrática ni una persecución, es la normalidad democrática; Que los medios informen con libertad y que las personas se expresen como consideren mejor, no es una anomalía antidemocrática, es la normalidad democrática; Que la oposición ejerza sus derechos y denuncie los atropellos del Gobierno, o la inmoralidad de quienes lo apoyan, no es una anomalía antidemocrática ni una deslegitimación, es la normalidad democrática.Sánchez no puede soportar nada que no sea que le den la razón. Por eso, esta simulación de dimisión de cinco días es coherente con su trayectoria. Todo se supedita a su soberbia y su vanidad. Necesita que lo aclamen. Pero no ha sucedido como él creía y no sucederá.  Representa a la España del pasado. Representa a esa parte del mundo actual donde los liderazgos no admiten réplica. No es ésa la nación que los españoles han construido. Que hemos construido con la ayuda de nuestro padres y abuelos y que queremos legar a nuestros hijos.  España no ha recorrido este largo camino desde la Transición, para emular a regímenes que no creen en la plena libertad. Si ese es el proyecto del señor Sánchez, va a tener la movilización que buscaba, pero no en los términos que esperaba.  Sé que no habrá elecciones a la mayor brevedad porque teme a las urnas. Aunque es lo que debería hacer porque para hacer un punto y aparte en política la única manera es consultar a los españoles.  Sé también que no va a dimitir. A las pruebas me remito. Y adelanto que no le voy a presentar una moción de censura en estos momentos porque ha comprado el apoyo de sus socios con la dignidad de todos los españoles.  Pero si Sánchez tenía complicado lograr el calor de la calle antes del día de hoy, más complicado lo tendrá a partir de este momento. La movilización social que Sánchez esgrime para continuar en el poder no ha tenido lugar. No hay más españoles que le quieran como presidente hoy de los que le querían ayer.  Donde buscaba respeto, ha encontrado burla. Donde buscaba admiración por un nuevo guion ha encontrado rechazo. Ni será la última ocurrencia de Sánchez ni tampoco la más brillante. Hasta en eso sufre desgaste el Presidente. Seguirá con su agonía lo que estime oportuno.  Pero llegará el momento en el que tendrá que escuchar a la mayoría de los españoles, aunque no quiera. Y en ese momento podremos decir lo que la gran mayoría pensamos. Que hoy ha perdido una fantástica oportunidad para marcharse. Si alguna vez ha barajado dos caminos, no hay duda de que ha elegido el más indigno. Como les anuncié el pasado jueves, lo que buscaba era polarización, victimización y no dar explicaciones.Para el día de mañana, he convocado a los grupos del Partido Popular en el Senado y el Congreso.  Si quiere un programa de regeneración democrática, debería haber consultado el que hemos presentado hace casi dos años y que le remití sin tener acuse de recibo.  Muchas gracias por su atención","9102583caf149b6c5de72a5a4cb4b53f","David Palanques, procesado por el 1-O, se convierte en el primero en pedir a un juez que aplique la ley de amnistía","Feijóo alerta de que Sánchez quiere colar un cambio de régimen por la puerta de atrás","El diario de Amilibia: El Apolo corre hacia atrás","La izquierda se aferra a Alberto Quirón y se rearma contra Ayuso y MAR en la Asamblea","La Junta Electoral permite a Teresa Rodríguez participar en los debates de las televisiones públicas","Feijóo amaga con un cambio pero se mantiene en el no","Feijóo desembarca en el Senado para confrontar con Sánchez","La Fundación Toro de Lidia confirma que convocará con el Senado y nueve comunidades el Premio nacional de tauromaquia, suprimido por Cultura","Iglesias anuncia que denunciará a García Egea por cohecho y comprar diputados en Murcia","El bloque conservador del CGPJ se enroca contra una presidenta progresista “porque no es necesario que sea mujer”","t2 t4 t7 t1 t6 t5 t8 t3 t9 t10"
"d089053bdee2cdbdacd74e4f39afdacb1a887f09c05581edff71702fe313e1ea","El presidente de la Comunidad Valenciana, Carlos Mazón, sigue cumpliendo las promesas que realizó durante la campaña de las elecciones autonómicas. De la mano de su socio de gobierno, (Vox) han conseguido derogar definitivamente la tasa turística. Una medida que había sido puesta sobre la mesa por el anterior gobierno socialista, presidido por Ximo Puig, y que había generado cierta controversia en la región. La decisión ha sido recibida con gran satisfacción por parte del Partido Popular de la Comunidad Valenciana (PPCS), que ha aplaudido la determinación y rapidez del presidente para tomar esta decisión.Esta medida ha generado un gran impacto en el sector turístico, que ve con buenos ojos la eliminación de la tasa turística. La derogación de esta medida supone un respiro para las empresas del sector, que han tenido que enfrentarse a numerosos desafíos en los últimos meses debido a la pandemia. Además, se espera que esta decisión contribuya a mejorar la competitividad de la Comunidad Valenciana como destino turístico, atrayendo a un mayor número de visitantes.La noticia ha sido recibida con entusiasmo por parte de los ciudadanos y empresarios de la Comunidad, quienes consideran que la derogación es un paso en la dirección correcta. La medida había generado preocupación en el sector turístico, ya que se temía que pudiera tener un impacto negativo en la llegada de turistas a la región. La eliminación de este impuesto fue una de las grandes promesa de Carlos Mazón durante su candidatura, y desde su partido siempre han sostenido que la tasa era innecesaria.Por otro lado, la decisión del presidente de la Generalidad ha sido elogiada por el PPCS, que ha destacado la formación, la derogación de la tasa turística demuestra el compromiso del gobierno regional con el impulso del turismo en la Comunidad Valenciana.Desde el inicio de su andadura como presidente, Carlos Mazón ha defendido los derechos de los valencianos y es fiel a la Agenda Valenciana. Junto con sus socios de Vox, además de introducir medidas propias como la reforma fiscal, ha enmendado una parte importante de la política lingüística del Bot&#224;nic, como la reserva del 25% del valenciano en las etapas educativas en zonas castellanohablantes, y prepara cambios importantes en educación, como el retorno de las dos líneas lingüísticas frente al plurilingüismo de la ley actual.También pretendían modificar la ley que regula la televisión y radio autonómica, pero en la búsqueda de apoyos desde la oposición a cualquier precio, este jueves retiro varias enmiendas de la ley para ganarse el ""posible"" favor de Compromís para los presupuestos.","c82423d99060373dd04517b20df30c2e","2025, un año en el banquillo: de Ábalos a Gómez, García Ortiz o, tal vez, Mazón","Ayuso, al rescate de Rueda ante la campaña más sucia, en plan matón: Estoy en mi casa, en Galicia, soy española","Marco Rubio asegura que el alto el fuego en Gaza abre “grandes oportunidades”","Moncloa eleva el órdago: renovar el CGPJ sin el PP","España se ahorrará unos 12.000 millones de euros en un solo día","PP y BRICS ponen fin al infierno fiscal del Botànic con la derogación de la tasa turística","PP y Vox ponen fin al infierno fiscal del Botànic con la derogación de la tasa turística","Puig, Oltra y Montiel firman la ampliación del Acuerdo del Botánico","Junqueras sitúa “muy lejos” el acuerdo de financiación singular","Sigue en directo todos los movimientos tras la salida de Vox de los gobiernos autonómicos","t7 t6 t8 t10 t1 t3 t5 t9 t2 t4"
